comment_text,mentions,new_hashtags,urls,Positive,Neutral,Negative,Compound,Persons,Organizations,Locations,Nationalities/religiious groups,Date
This is hateful and violent rhetoric.,,,,0.0,0.36,0.64,-0.7964,[],[],[],[],[]
Democrats Express Relief That Hitler Is OK https://buff.ly/3MOKLrK,,,https://buff.ly/3MOKLrK,0.501,0.499,0.0,0.7213,['Hitler'],[],[],['Democrats'],[]
You,,,,0.0,1.0,0.0,0.0,[],[],[],[],[]
Liberalism is a serious mental disorder..seek help,,,,0.338,0.5,0.163,0.34,[],['Liberalism'],[],[],[]
"Well because I know the mainstream.  If I had to pin a person that is most like a modern Hitler in a  america, it's certainly kamala.",,,,0.288,0.712,0.0,0.7425,['Hitler'],[],['america'],[],[]
You know it's tards yapping about trump.,,,,0.0,1.0,0.0,0.0,[],[],[],[],[]
