comment_text,mentions,new_hashtags,urls,Positive,Neutral,Negative,Compound,Persons,Organizations,Locations,Nationalities/religiious groups,Date
Awesome ,,,,1.0,0.0,0.0,0.6249,[],[],[],[],[]
God is truly Good.!,,,,0.726,0.274,0.0,0.6476,[],[],[],[],[]
No doubt about it ,,,,0.0,0.299,0.701,-0.5719,[],[],[],[],[]
I feel like a Biology major  ,,,,0.455,0.545,0.0,0.3612,[],[],[],[],[]
We don't even have to worry about that nonsense much anymore after We The People spoke and said we are ready to get back to normal.,,,,0.08,0.74,0.18,-0.4767,[],[],[],[],[]
