comment_text,mentions,new_hashtags,urls,Positive,Neutral,Negative,Compound,Persons,Organizations,Locations,Nationalities/religiious groups,Date
What a cunty thing to say - Pr1ck,,,,0.0,1.0,0.0,0.0,[],[],[],[],[]
Hello,,,,0.0,1.0,0.0,0.0,[],[],[],[],[]
Not long I'm sure,,,,0.0,0.605,0.395,-0.2411,[],[],[],[],[]
Does she have sleeping sickness,,,,0.0,1.0,0.0,0.0,[],[],[],[],[]
Biden accused  elon of steeling his presidency when  he bought  X,,,,0.0,0.804,0.196,-0.296,[],['Biden'],[],[],[]
Lord of the White House with a political twist… Biden accuses @elonmusk of stealing his Presidential Seal ring when he bought twitter/X !   Starring:,@elonmusk,,,0.0,0.758,0.242,-0.75,['Biden'],['the White House'],[],[],[]
